daño,Predicción
cable ubicado en losa con signos visibles de malla expuesta en intemperie,ejecutar
facturacion elevada,ejecutar
aumento de cobro,ejecutar
la energia es muy debil,cancelar
mi queja es sobre el alumbrado publico,cancelar
cable ubicado en losa con signos visibles de malla expuesta en intemperie,ejecutar
predio sin energia,cancelar
cuerdas de acometidas reventadas por paso de un vehiculo,cancelar
a 5 minutos de san vicente caserio de pueblo nuevo,ejecutar
cable de alta tension a punto de caerse al frente del predio,ejecutar
danos en el cable,ejecutar
hay una carga alta en el contador lo que ha generado que se derrita un cable,ejecutar
sin energia,cancelar
8 viviendas sin energia sector sin energia,cancelar
bombilla de alumbrado publico fallando,cancelar
cancelar internet,cancelar
la acometida se safo de poste no llega el voltaje completo me toco conectar del 2 piso con una extencion por que estoy sin energia,cancelar
no enciende la luz del poste hace 3 dias,cancelar
bajones de energia,ejecutar
se organizo el dano q reporte ayer pero los cables q dan energia a la casa estan muy quemados se quemo la acomerida,cancelar
linea reventada,ejecutar
es falla de internet,cancelar
no enciende la luz del poste hace 3 dias,cancelar
se subio la energia,cancelar
no hay fluido de luz en el sitio,ejecutar
no hay luz desde ayer en la manana,cancelar
fluctuacion de voltaje,ejecutar
no es un corto porque los breaks no se han disparado yo creo que es un cable que esta medio mochado,ejecutar
variacion de voltaje,cancelar
muy bajo voltaje no arranca  la nevera,ejecutar
corto,ejecutar
solicito q vengan el sector a para rebicion del medidor de mi casa,cancelar
fue corte pero ayer fui a la oficina y hice un convenio para que recorte,ejecutar
los cables estan flojos y al,ejecutar
tengo un negocio hace dos dias no lo he podido abrir  ayer fueron los de celsia quitaron la energia,ejecutar
no hay poste para acometidas cercanas,cancelar
pues nos habian cortado la energia ya casi 20 dias y los que vinieron acortarla se llevaron el taco,ejecutar
sin luz  en el poste diagonal a mi casa,ejecutar
esta llegando alterado el recibo,ejecutar
poca energia,cancelar
sector sin servicio,cancelar
en la casa unas partes hay energia y en otras no,ejecutar
el predio sin energia,cancelar
alumbrado publico sin servicio,cancelar
estan la cuerda de la luz muy colgante,ejecutar
tormenta dano transformador,cancelar
se callo una palma y revento el cable de ambos lados,ejecutar
no tengo servicio de energia,ejecutar
un poste presenta fuego y humo,ejecutar
estamos en totalidad sin energia,ejecutar
85,"Entrada inválida. Por favor, ingrese un texto coherente."
camion paso y rompio la linea de internet,cancelar
el cobro de mi energia es muy alto,ejecutar
un apagon y las tomas y algunos bombillos sin energia,ejecutar
hay unas casas q tiene,ejecutar
constantemente va y vuelve el servicio,ejecutar
subida de consumo excesivo y falla en el codigo de contador de los dos pisos,ejecutar
varios locales sin energia,cancelar
sin servicio de energia,cancelar
mi predio esta desocupado varios meses,ejecutar
variacion de voltaje solo en la finca santa lucia y se me estan danando los electrodomesticos,ejecutar
ayer colocaron un contador y por la tempestad de ayer se revento un cable del poste,cancelar
hola buenas tardes,ejecutar
lampara de poste que no prende,cancelar
luminarias sin energia al rededor del sector las cuales dejan vulnerables a los habitantes para hurtos y violencia en general,ejecutar
no pues como le digo esa cuerda debe estar suelta por q no pasa energia,cancelar
el numero de medidor no corresponde al de la factura,cancelar
el contador al parecer esta fallando,ejecutar
hubo un corto anoche y se destruyeron varios cables,ejecutar
se revento el cable,ejecutar
lamparas apagadas,ejecutar
sin iluminacion,ejecutar
todos los postes sobre la calle 26 se encuentran apagados a la hora y llevan mas de 3 dias asi,ejecutar
ha variacion en el voltaje,ejecutar
verificar falla en la red,ejecutar
mi reporte 354414276 dicen que le corresponde a los de la acometida,cancelar
variacion exagerada de energia en el enchufe de la lavadora y la nevera,ejecutar
esta baja la luz conecto nevera y se ba,ejecutar
se cayo un arbol y revento cuerdas esta con chispas,ejecutar
factura me esta llegando muy elevada el conteo que tiene la factura no es el mismo conteo que hay en el contador,ejecutar
cuerda reventada,ejecutar
la verdad es para regular la corriente que esta entrando ya que la bomba trabaja con 220 voltios,ejecutar
datos del medidor,cancelar
recibo de servicio publico por costo elevado,ejecutar
cable danado por volqueta,ejecutar
contador no marca,ejecutar
no conexion del cable del poste hacia la casa,ejecutar
el poste frente a la direccion mencionada se encuentra sin energia,cancelar
incendio de medidor de casa,cancelar
luminarias sin energia al rededor del sector las cuales dejan vulnerables a los habitantes para hurtos y violencia en general,ejecutar
no hay energia,ejecutar
no tengo energia mientras los demas si,ejecutar
la energia no es estable,ejecutar
falla de internet,cancelar
se fue la luz,ejecutar
alteracion del consumo,ejecutar
la luminaria de la calle no funciona desde el lunes,cancelar
en el breke del conductor de afuera de la casa esta hechando chispa en un cable y hace titiritiar los bombillos de la casa,cancelar
sin luz,cancelar
no hay internet,cancelar
el cable esta suspendido por toda la carretera,cancelar
paso un carro grande y tumbo el medidor,ejecutar
los bombillos estan titilando intermitente,ejecutar
son las lamparas de alumbrado publico,cancelar
voltaje insuficiente,cancelar
desde que pusieron el contador la energia no funciona adecuadamente dentro de la casa,cancelar
solicito revision por alto consumo,ejecutar
se revento  la cuerda,cancelar
variacion de voltaje,cancelar
tuve suspension  de servicio por no pago,cancelar
es que resulta que pusieron un poste nuevo pero no movieron los medidores del riel al poste nuevo,cancelar
arboles tocando las lineas y con 3l viento generan variacion de voltaje y me he quedado sin energia,ejecutar
lineas reventadas,ejecutar
no hay servicio desde hace 3 dias,cancelar
bajones de energia constante y ya me dano unos electrodomesticos,ejecutar
se cayo un arbol y revento cuerdas esta con chispas,ejecutar
ninguna es cambio de carga,cancelar
dano contador,ejecutar
suena duro un corto en la red alrededor de mi casa,ejecutar
no contamos con energia,ejecutar
cuando enciendo los electrodomesticos se apagan las luces y baja el voltaje en la casa y ya han vendio 2 veces y nada que me solucionan el problema,ejecutar
desde la manana esta sin energia el sector,ejecutar
sector hace dos meses con fluctuacion de energia ya hicieron revisiones internas no es interno,cancelar
la factura cada mes aumenta mas,ejecutar
sin servicio de luz,ejecutar
se me revento la acometida,cancelar
dano de energia,cancelar
por favor sin energia en el sector por favor ayuda,ejecutar
bajon de energia,ejecutar
desde la manana habemos 7 locales comerciales sin servicio y nosotros manejamos biologicos vacunas y necesitamos nevera,cancelar
sector con variacion de voltaje,ejecutar
se llevaron el cable del poste al contador estoy sin luz,ejecutar
sector sin servicio de alumbrado publico,cancelar
no tengo internet desde las 9 am,cancelar
cable reventado por un camion,ejecutar
si desconecto todo y bajo los automaticos sigue habiendo energia alimentando parte de mi casa,ejecutar
hubo un dano de el transformador afuera en la calle y despues que vinieron a solucionar,ejecutar
estamos en totalidad sin energia,ejecutar
servicio intermitente cortes cada nada,ejecutar
se robaron el contador de la energia,ejecutar
al suspender el flujo de energia ,ejecutar
problema en el contador,ejecutar
estoy sin internet estando al dia con el pago,cancelar
se cayo un arbol,cancelar
se salta el taco,ejecutar
se va la energia en cada instante,ejecutar
se fue la energia,ejecutar
necesito q el cable del poste hacia la casa este mas largo,ejecutar
linea caida en la finca del senor orlain  giraldo,ejecutar
tenemos,ejecutar
alteracion de la lectura de mi predio,ejecutar
el cable esta descolgado y los carros que pasan lo pueden reventar,ejecutar
el wifi es muy lento,cancelar
tuve visita de dos funcionarios de celsia los cuales dijeron que habia una queja por alto consumo y que ivan a cambiar el contador hable con el lector y me dice que el no ha reportado nada,ejecutar
varios locales sin energia,cancelar
linea reventada por arbol caido,ejecutar
energia intermitente,cancelar
cayo arbol y revento cables de energia y tambien afecto el cable del internet tambien de celsia esto es desde el sabado,cancelar
muy pocas personas en la casa para el costo tan elevado q llega en la factura,ejecutar
buena noche,cancelar
sin servicio de alumbrado,cancelar
consumo maximode energia,ejecutar
esquina,cancelar
el voltaje varia y no funcionan los electrodomesticos,ejecutar
lo despegamos para hacer una pared nueva en la casa,ejecutar
no hay energia desde las 9,cancelar
hay fuego en el poste,ejecutar
no tenemos internet,cancelar
no hay luz,cancelar
el cable del poste se solto,ejecutar
hay dos lamparas que no prenden,cancelar
la lampara de alumbrado publico de la via de acceso a mi vivienda no funciona con normalidad,cancelar
poste con energia intermitente,cancelar
aumento en la factura,cancelar
no hay voltaje suficiente,ejecutar
contador caido y sin tapa,cancelar
la casa quedo con muy poca energia y no le llegan a la nevera ni a los televisores solo prenden los focos,ejecutar
atras hay tres postes de energia y no hay energia esta oscuras atras del edificio,ejecutar
las luces de los postes de las calles y 14,ejecutar
hola,ejecutar
los cables estan demaciado bajos,ejecutar
el cable quedo muy templado  y  el tubo do de entra el cable quedo caido se necesita  destemplar el cable del poster para acomodar,cancelar
sin luz dos casas,ejecutar
en el transcurso del dia se ha visto una variacion en el voltaje que a afectado varios electrodomesticos y los ha danado,ejecutar
vereda sin energia desde hace 15 dias,cancelar
empty,ejecutar
no tenemos luz,ejecutar
de rompio el cable gris  q conecta al modem,ejecutar
totalmente sin internet,cancelar
es en la cuadra no tiene energia las lamparas,ejecutar
no hay alumbrado publico,cancelar
no hay luz,cancelar
cable colgando con posibilidad que otro vehiculo termino llevando el cableado,ejecutar
dano medidor,cancelar
si energia el sector,ejecutar
es lampara prende a ratos,ejecutar
alto consumo de los dos ultimos meses,cancelar
variaciones de voltaje,cancelar
no ahi energia,ejecutar
cable de entrada no existe,cancelar
no hay luz en toda la cuadra,ejecutar
todo el sector sin energia una manzana completa,cancelar
sector sin servicio de energia,cancelar
dano en la caja de contador,ejecutar
el viento la desplazo dejando sin energia el lugar,ejecutar
luminarias sin energia al rededor del sector las cuales dejan vulnerables a los habitantes para hurtos y violencia en general,ejecutar
bajo voltaje,cancelar
no se la verdad,ejecutar
hace una semana paso ,cancelar
no tengo luz en la casa,ejecutar
intermitencia de energia va y vuelve,cancelar
el medidor esta danado,cancelar
los bombillos parpadean cuando se encienden,ejecutar
no hay servicio desde hace 3 dias,cancelar
cable de energia caido en la calle expuesto a electrocucion,ejecutar
linea caida,ejecutar
un apagon y las tomas y algunos bombillos sin energia,ejecutar
explicame brevemente el tipo de falla que presentan,ejecutar
no tengo energia por dano en el cable exterior,ejecutar
el voltaje es muy bajito,ejecutar
esta presentandose alta carga de energia lo que puede danar los electrodomesticos,cancelar
se dana no lo tengo,ejecutar
estoy sin internet estando al dia con el pago,cancelar
2 lamparas del alumbrado publico no funcionan,cancelar
voltaje a incrementado cada mes el doble,ejecutar
el consumo llega mas de lo usado,cancelar
la iluminacion de los postes del alumbrado publico prenden y apagan constantemente,cancelar
cables  colgantes,ejecutar
sin energia cable roto,ejecutar
el poste frente a la direccion mencionada se encuentra sin energia,cancelar
robo de cable y estamos sin energia,ejecutar
dano de la linea,ejecutar
muestra muchas variaciones,ejecutar
unas guaduas caidas en las cuerdas principales,ejecutar
baja tension no llega suficiente voltaje al predio cerca al crucero via vereda san pablo,ejecutar
el consumo reportado en la factura es exagerado,cancelar
me llego un cobro excesivo para el consumo,ejecutar
no tenemos luz,ejecutar
sin energias en algunas areas de la casa,ejecutar
baja y sube el voltaje,ejecutar
se apagan y se prenden los electrodomesticos cada 5 minutos,ejecutar
farolas estan sin energia 3 postes danados,ejecutar
contador fuera de servicio,cancelar
un carro hizo caer varios cable de alta tension de un poste en la calle,ejecutar
bajones de energia,ejecutar
se fue la luz,ejecutar
variacion de voltaje y cambio de acometida ya que estan trabajando en el sector,cancelar
esta la luz muy baja,cancelar
cayo un rayo y la linea  esta en el piso,ejecutar
linea que va al poste reventado,ejecutar
la bombilla no funciona,cancelar
se revento la cuerda de energia del poste al edificio,cancelar
incendio en transformador,ejecutar
no llega energia a la casa muy deficiente se va y vuelve,cancelar
variacion de voltaje,cancelar
no esta marcando el consumo en el contador,ejecutar
me llego casi el doble de cobro en el servicio,ejecutar
tengo dervicio de internet con celsia y esta reventando el cable,cancelar
velas caidas,ejecutar
bajon de luz a cada rato,ejecutar
poste echa chispas con ruido fuerte y no alumbran las bombillas,cancelar
empty,ejecutar
se prende y apaga mucho la lampara del poste en esta direccion sobre la calle 26 b2,cancelar
estoy sin luz,cancelar
1 huella a mano derecha subiendo,ejecutar
se subio la energia,cancelar
se fue la energia por quema del contador,ejecutar
medidor danado hay variacion estando desocupado,cancelar
cable reventado,cancelar
exploto el contador de mi casa y ya lo he reportado varias veces y nada q vienen por favor,ejecutar
se revento la cuerda de energia del poste al edificio,cancelar
se va la energia en toda la casa despues de conectar la bomba de sacar agua,ejecutar
variacion en voltaje,cancelar
variacion de voltaje,cancelar
suena muy fuerte el transformador,ejecutar
el contador esta apagado y no tengo servicio de energia en mi casa,ejecutar
intermitencia en el alumbrado,cancelar
variacion de voltaje,cancelar
empty,ejecutar
no tenemos luz en la calle,ejecutar
el recibo llega muy alto solo hay un televisor y dos bombillos vive solo una persona  el consumo cada vez es mas alto,ejecutar
energia no constante y los bombillos estan encendidos a medias,ejecutar
el aire acondicionado funciona a 220voltios y no esta prendiendo,ejecutar
me estan cobrando mucho los ultimos 6 meses,ejecutar
no hay energia,ejecutar
cambiaron un poste y la luz no es estable en mi casa,ejecutar
paso un tren canero y revento las cuerdas cuando danos en los contadores,ejecutar
el consumo reportado en la factura es exagerado,cancelar
no hay luz,cancelar
la cuadrilla de ustedes bajo la acometida atrevidamente,cancelar
esta presentandose alta carga de energia lo que puede danar los electrodomesticos,cancelar
la linea de energia que conecta del poste a la casa,ejecutar
empty,ejecutar
apenas conectamos la nevera se baja la energia de toda la casa,ejecutar
hubo un dano de el transformador afuera en la calle y despues que vinieron a solucionar,ejecutar
el contador  danado,ejecutar
ya habia reportado,cancelar
necesitamos reparacion de lampara del sector,cancelar
variacion de voltaje,cancelar
es en el contador,ejecutar
no hay energia desde hace mas de una hora,ejecutar
todo el sector con bajones de energia,ejecutar
4 veces variacion de voltaje,ejecutar
los costos son muy caros,ejecutar
fase averiada,ejecutar
no tengo servicio,ejecutar
sube y baja la energia,cancelar
bajo voltaje dentro de mi casa y los bombillos intermitentes,cancelar
sin energia en toda la calle 33 a con 15,ejecutar
no hay luz,cancelar
estamos sin energia y hay un corto,ejecutar
caida del cable que va del poste al contador de la casa hace ya 3 dias,cancelar
no prende una zona de la casa,cancelar
variacion de voltaje,cancelar
no es un corto porque los breaks no se han disparado yo creo que es un cable que esta medio mochado,ejecutar
no hay energia,ejecutar
poste con foco danado,ejecutar
el voltaje ,ejecutar
se se calienta demasiado la caja  becquer donde conecta el contador,ejecutar
anche intento de robo linea descolgada,ejecutar
no esta funcionando la lampara de la calle desde el lunes,cancelar
al respaldo,cancelar
variacion el voltaje,ejecutar
el contador no sirve estamos sin luz hace 5 dias,cancelar
hay 2 bombillos del alumbrado publico que se apagan y prenden todo el tiempo,cancelar
somos un edificio de 6 apartamentos sin servicio,ejecutar
corto en cuerdas electricas y malla posiblemente con electricidad del polideportivo y hay ninos en el sector,ejecutar
sin energia toda la verdad,ejecutar
se estan presentando constantes fluctuaciones de voltaje,ejecutar
linea abierta en el poste,cancelar
sin servicio,cancelar
sin energia peligro,ejecutar
se descogo la linea que va del poste a la casa y deproto un vehiculo la revienta por que esta muy bajita,cancelar
linea reventada,ejecutar
se revento el cable de la acometida,cancelar
bombillos y tv si,ejecutar
la falla es en postes,ejecutar
chispas en la caja,cancelar
buenas noches,ejecutar
me llego muy caro el recibo de la luz,ejecutar
cables de la calle caidos,ejecutar
requiero dar de baja a 3 contadores y revision de la acometida o la caja donde se encuentran los cables,cancelar
el recibo llega muy alto solo hay un televisor y dos bombillos vive solo una persona  el consumo cada vez es mas alto,ejecutar
lo despegamos para hacer una pared nueva en la casa,ejecutar
dano que hizo el carro de la basura al contador de la energia,ejecutar
el voltaje varia y no deja funcionar los electrodomesticos,ejecutar
mi predio tiene variacion en el voltaje,ejecutar
fluctuacion de voltaje en el sector quedando por minutos sin fluido electrico,ejecutar
no enciende ninguna de las lamparas estamos a oscuras,cancelar
varios postes sin luz y muchos drogadictos aprovechan la oscuridad para fumar bajo los arboles,cancelar
muy alto y bajo el voltaje ya me quemo una unidad y requiero urgente que revisen ese voltaje por que me puede quemar las otras unidades de la never,cancelar
85,"Entrada inválida. Por favor, ingrese un texto coherente."
no enciende la luz del poste y estamos a oscuras en la calle,ejecutar
viene de llamada anterior 355619506 asociada al incidente 145257093 dano en red secundaria salida del trafo,ejecutar
problema en el contador,ejecutar
esta la luz muy baja,cancelar
la energia va y viene en repetidas ocasiones,ejecutar
oscilacion de voltaje linea de baja tension descolgada,ejecutar
y se va la energia y vuelve pero muy bajo,ejecutar
la acometida que lleva la energia hacia mi casa una rama de un arbol cayo y la descolgo,cancelar
la luminaria de la calle no funciona desde el lunes,cancelar
el dia de ayer quede sin energia en toda la vivienda,cancelar
un ave se estrello provoco corto,ejecutar
el wifi no funciona,cancelar
bajon de luz desde el viernes y el sabado se fue de una vez,cancelar
trato con line inactiva y ap sin energia,ejecutar
cable reventado,cancelar
no tengo energia,cancelar
falla en el contador,ejecutar
no tengo energia electrica en la casa,cancelar
bombilla fundida en poste,cancelar
no hay servicio solo en mi casa,ejecutar
no funcionan los equipos baja la energia,cancelar
variacion de voltage y alto consumo en el servicio se requiere una inspeccion y verificar si el medidor se encuentra en buen estado,cancelar
cuerda caida rota,ejecutar
un tercero se esta conectando a mi red,ejecutar
lampara del alumbrado publico danada,cancelar
se quemo el cable q sale de las cuerdas principales al contador,cancelar
sin energia,cancelar
arrojaron una piedra contra el el contador y  le quebraron la proteccion,ejecutar
las luces de los postes de las calles y 14,ejecutar
lampara fundida,cancelar
el recibo llega muy costoso,cancelar
los cables estan flojos y al,ejecutar
dano contador,ejecutar
paso un carro y revento la linea y esta generando peligro,ejecutar
las casas presentan voltaje en variacion,ejecutar
me llego mi recibo del mes de mayo en ceros quiero saber el porque,ejecutar
carro revienta cuerda y el transformador esta haciendo corto y el predio esta sin energia,ejecutar
presunto robo de contador frustrado,ejecutar
incendio en transformador,ejecutar
mi consumo anterior mente era de 20,ejecutar
hay dos lamparas que no prenden,cancelar
los bombillos estan titilando intermitente,ejecutar
no hay alumbrado publico en 2 manzanas,cancelar
sin corriente electrica,ejecutar
tengo facturacion excesiva y ya viven menos personas en casa,cancelar
no esta marcando consumo,cancelar
sector hace dos meses con fluctuacion de energia ya hicieron revisiones internas no es interno,cancelar
no hay alumbrado publico hace un par de semanas,cancelar
es estrato 2 y me llega el valor de la factura por ,ejecutar
desde ayer en la tarde el voltaje de energia sube y baja,ejecutar
luminarias sin alimentacion de energia 220,ejecutar
corto por arboles,ejecutar
caida poste,cancelar
un camion revento el cable del internet celsia,cancelar
es falla de internet,cancelar
desprendimiento cable del poste por borrasca,ejecutar
se revento el cable de alta tension y esta en el suelo,ejecutar
el cable pasa por la sala del vecino,ejecutar
1 huella a mano derecha subiendo,ejecutar
variacion de voltaje,cancelar
un ave se estrello provoco corto,ejecutar
bajo voltaje en el sector donde se encuentran ubicados los paneles solares de la institucion,ejecutar
muestra muchas variaciones,ejecutar
muestra que tengo consumo de energia en una casa que esta desocupada,ejecutar
sin internet,cancelar
sin luz,cancelar
hay que hacer revision de la red porque ha quemado el contador,ejecutar
se dano la luz del poste,ejecutar
no hay energia,ejecutar
cable que va del poste al contador de la casa se revento,ejecutar
linea que va al poste reventado,ejecutar
luz intermitente,cancelar
en inmediaciones del cementerio,cancelar
se fue la energia en todo el sector  yo trabajo con energia y llego en todos lados menos en el local,ejecutar
varios postes sin luz y muchos drogadictos aprovechan la oscuridad para fumar bajo los arboles,cancelar
poste de afuera de mi casa esta sin luz,ejecutar
fluctuacion de voltaje en el sector quedando por minutos sin fluido electrico,ejecutar
no hay servicio de luz,ejecutar
el poste de energia que esta fuera de mi casa no tiene luz hace 5 noches,ejecutar
exploto el contador de mi casa y ya lo he reportado varias veces y nada q vienen por favor,ejecutar
cuerdas de acometidas reventadas por paso de un vehiculo,cancelar
carro de la basura tumbo la acometida,cancelar
sin energia,cancelar
tenemos caida por lo menos una fase del servicio 220 trifasico que tenemos,ejecutar
variacion de voltaje en el sector,ejecutar
varias casas sin servicio,ejecutar
hay dos lamparas que no prenden,cancelar
no hay internet,cancelar
la energia esta parpadeando de forma peligrosa para los electrodomesticos,ejecutar
no hay servicio desde hace 3 dias,cancelar
no hay luz,cancelar
acometida floja cuando pasan la mueven y me quedo sin energia,cancelar
tuve visita de dos funcionarios de celsia los cuales dijeron que habia una queja por alto consumo y que ivan a cambiar el contador hable con el lector y me dice que el no ha reportado nada,ejecutar
energia no constante y los bombillos estan encendidos a medias,ejecutar
hay una cuerda del alumbrado publico caida sobre la entrada de mi casa y por obvias razones no hay alumbrado publico en un tramo de la carretera,cancelar
se iban a robar el cable del contador y hicieron un corto,ejecutar
polo a tierra esta haciendo contacto con el cincho metalico que lo sujeta,ejecutar
el poste frente a la direccion mencionada se encuentra sin energia,cancelar
dano contador,ejecutar
lampara no apaga,ejecutar
no hay electricidad,cancelar
hace dias el transformador sufrio un dano y lo cambiaron desde hay presento falla en el voltaje,ejecutar
sin servicio de energia por cable en el suelo,ejecutar
y el cable  esta en el suelo echando chispas y hay muchos ninos jugando,ejecutar
linea baja que hecha chispas,ejecutar
el contador  danado,ejecutar
en mi casa la energia es 220 y esta en 110,ejecutar
osea chispas,ejecutar
no luz en el,ejecutar
el cable esta descolgado y los carros que pasan lo pueden reventar,ejecutar
numero de radicado,ejecutar
demasiado elevada la factura,ejecutar
toda la cuadra de mi casa sin energia,ejecutar
ayer colocaron un contador y por la tempestad de ayer se revento un cable del poste,cancelar
me llego mi recibo del mes de mayo en ceros quiero saber el porque,ejecutar
variacion del voltaje,cancelar
todos los bombillos parpadean,ejecutar
no hay luz,cancelar
suena duro un corto en la red alrededor de mi casa,ejecutar
sin energia en casa,ejecutar
cortocircuito,cancelar
el posta de la luz se encuentra si alumbrado y hurtaron cosas de mi casa por oscuridad en el sector,cancelar
no hay fluido electrico en el inmueble a razon del cable reventado,ejecutar
intermitencia se va y vuelve la energia dentro de la casa,cancelar
empty,ejecutar
dano de corto,ejecutar
baja potencia,cancelar
dano en electrodomesticos,ejecutar
sin servicio de luz,ejecutar
la energia va y vuelve,ejecutar
baja y sube el voltaje,ejecutar
la bombilla no funciona,cancelar
es la segunda vez que nos pasa que la energia se pone intermitente hasta que luego se va definitivamente,cancelar
sin energia en el parque de margaritas 2 ya va para 2 semanas y pues en la noche entrenan un equipo de futbol y pues como no hay energia en el parque no han podido entrenar bien,ejecutar
bombilla,ejecutar
conexion a internet intermitente,cancelar
no tengo energia,cancelar
